<?xml version="1.0" encoding="UTF-8"?>
<!DOCTYPE trans SYSTEM "converter.dtd">
<trans name="sysOperationLog/list" desc="列表" group="操作日志" groupCode="sysOperationLog">
    <send>
        <!--这里存放的是参数,之后补充完善-->
        <item name="pageNo" desc="页码" type="Integer" default="1"/>
        <item name="pageSize" desc="页容量" type="Integer" default="15"/>
        <item name="opTimeQueryGe" desc="开始时间"/>
        <item name="opTimeQueryLe" desc="结束时间"/>
    </send>
    <rcv>
        <item name="total" type="Integer" desc="id" default="0"/>
        <item-list name="list" desc="列表">
            <item name="id" desc="id" type="Integer"/>
            <item name="targetServer" desc="访问实例"/>
            <item name="requestPath" desc="请求路径"/>
            <item name="ip" desc="请求ip"/>
            <item name="requestMethod" desc="请求方法"/>
            <item name="schema" desc="协议"/>
            <item name="osType" desc="操作系统类型"/>
            <item name="token" desc="令牌"/>
            <item name="userId" desc="用户ID" type="Integer"/>
            <item name="userName" desc="用户名称" target="userId" mapper="USER_PERSON_NAME_HASH"/>
            <item name="requestBody" desc="请求体"/>
            <item name="responseData" desc="响应体"/>
            <item name="requestTime" desc="请求时间"/>
            <item name="responseTime" desc="响应时间"/>
            <item name="executeTime" desc="执行时间" type="Integer"/>
        </item-list>
    </rcv>
</trans>
