<?xml version="1.0" encoding="UTF-8"?>
<!DOCTYPE trans SYSTEM "converter.dtd">
<trans name="ucenterPosition/view" desc="职位管理-查看" group="职位管理" groupCode="ucenterPosition">
    <send>
        <item name="id" desc="id" type="Integer" required="true"/>
    </send>
    <rcv>
        <item name="id" desc="id" type="Integer"/>
        <item name="orgId" desc="机构ID 为系统后续多机构新增字段" type="Integer"/>
        <item name="orgName" desc="机构名称"/>
        <item name="name" desc="名称"/>
        <item name="code" desc="代码"/>
        <item name="type" desc="类型"/>
        <item name="typeName" desc="类型名称" target="type" mapper="CODE_HASH"/>
        <item name="memo" desc="描述"/>
    </rcv>
</trans>

