<?xml version="1.0" encoding="UTF-8"?>
<!DOCTYPE trans SYSTEM "converter.dtd">
<trans name="sysOperationLog/add" desc="新增" group="操作日志" groupCode="sysOperationLog">
    <send>
        <item name="className" desc="类名"/>
        <item name="columnName" desc="字段名"/>
        <item name="oldValue" desc="修改后"/>
        <item name="newValue" desc="修改后"/>
        <item name="billNo" desc="业务单号"/>
        <item name="bizId" desc="业务ID"/>
        <item name="userId" desc="用户ID"/>
        <item name="account" desc="账号"/>
        <item name="ip" desc="ip"/>
        <item name="machineName" desc="机器名称"/>
        <item name="time" desc="操作时间"/>
    </send>
    <rcv>
        <item name="id" desc="id" type="Integer" ignore-key="true"/>
    </rcv>
</trans>
