<?xml version="1.0" encoding="UTF-8"?>
<!DOCTYPE trans SYSTEM "converter.dtd">
<trans name="sysParameter/save" desc="保存" group="系统参数" groupCode="sysParameter">
    <send>
        <item name="idDelIn" desc="要删除ids"/>
        <item name="orgId" desc="机构ID" type="Integer" required="true"/>
        <item name="orgName" desc="机构名称"/>
        <item name="setType" desc="参数类型" scope="1,2,3" required="true"
              notes="系统设置参数类型 1-系统运行参数、2-管理属性、3-系统显示设置"/>
        <item-list name="parameters" desc="参数集合">
            <item name="id" desc="id" type="Integer" notes="修改时需上传"/>
            <item name="keies" desc="key" required="true"/>
            <item name="descript" desc="描述"/>
            <item name="value" desc="值" required="true"/>
            <item name="type" desc="类型"/>
            <item name="subType" desc="子类型"/>
            <item name="orderNo" desc="排序" type="Integer"/>
            <item name="remark" desc="备注"/>
        </item-list>
    </send>
    <rcv>
    </rcv>
</trans>
