<?xml version="1.0" encoding="UTF-8"?>
<!DOCTYPE trans SYSTEM "converter.dtd">
<trans name="role/add" desc="角色管理-新增" group="角色管理" groupCode="role" >
    <send>
        <item name="name" desc="名称" required="true"/>
        <item name="code" desc="代码" required="true"/>
        <item name="memo" desc="备注"/>
        <item name="orderNo" desc="顺序号" type="Integer"/>
    </send>
    <rcv>
        <item name="id" desc="id" type="Integer" ignore-key="true"/>
    </rcv>
</trans>

