<?xml version="1.0" encoding="UTF-8"?>
<!DOCTYPE trans SYSTEM "converter.dtd">
<trans name="personOrg/view" desc="查看单个人员的人员部门信息" group="部门调整" groupCode="personOrg">
    <send>
        <item name="personId" desc="人员id" type="Integer" required="true"/>
    </send>
    <rcv>
        <item name="id" desc="id" type="Integer"/>
        <item name="type" desc="类型" notes="1：人员机构中间表，0：人员部门中间表" type="Integer"/>
        <item name="deptId" desc="部门Id" type="Integer"/>
        <item name="deptName" desc="部门名称" target="deptId" mapper="ORG_HASH"/>
        <item name="personId" desc="人员Id" type="Integer"/>
        <item name="personName" desc="人员名称" target="personId" mapper="PERSON_HASH"/>
        <item name="posId" desc="职位ID" type="Integer"/>
        <item name="posName" desc="职位名称" target="posId" mapper="POS_HASH"/>
        <item name="isMain" desc="主机构" notes="1-是" type="Integer"/>
        <item name="isMainPerson" desc="主要负责人" notes="1:是  0:否" type="Integer"/>
        <item name="orderNo" desc="顺序号" type="Integer"/>
    </rcv>
</trans>

