<?xml version="1.0" encoding="UTF-8"?>
<!DOCTYPE trans SYSTEM "converter.dtd">
<trans name="code/list" desc="系统代码-列表" group="代码管理" groupCode="code">
    <send>
        <item name="pageNo" desc="页码" type="Integer" default="1"/>
        <item name="pageSize" desc="页容量" type="Integer" default="15"/>
        <item name="type" desc="类别(精确查询)"/>
        <item name="codeQueryLike" desc="代码模糊查询"/>
        <item name="nameQueryLike" desc="名称模糊查询"/>
        <item name="codeOrNameQueryLike" desc="代码或者名称查询"/>
        <item name="pathValueQueryLike" desc="pathValue模糊查询"/>
        <item name="typeQueryNotIn" desc="类型过滤"/>
    </send>

    <rcv>
        <item name="total" type="Integer" desc="数据总量" default="0"/>
        <item-list name="list" desc="list">
            <item name="id" desc="id" type="Integer"/>
            <item name="locale" desc="国际化"/>
            <item name="code" desc="代码"/>
            <item name="value" desc="代码值"/>
            <item name="pathValue" desc="PATH"/>
            <item name="name" desc="名称"/>
            <item name="orderNo" desc="排序字段" type="Integer"/>
            <item name="type" desc="类别"/>
            <item name="typeValue" desc="类别名称" mapper="CODE_HASH" target="type"/>
            <item name="parent" desc="父级"/>
            <item name="parentValue" desc="父级" mapper="CODE_HASH" target="parent"/>
            <item name="isSys" desc="系统/用户" notes="1-系统 0-用户" type="Integer"/>
        </item-list>
    </rcv>
</trans>

