<?xml version="1.0" encoding="UTF-8"?>
<!DOCTYPE trans SYSTEM "converter.dtd">
<trans name="org/tree" desc="机构部门树" group="部门管理" groupCode="org">
    <send>
        <item name="isAll" desc="是否进行权限过滤 不为空就查询所有机构,为空就查询当前人所属机构的" type="Integer"/>
    </send>
    <rcv>
        <item-tree name="list" desc="list" ignore-key="true" treeKey="children" real-type="List">
            <item name="id" desc="id" type="Integer"/>
            <item name="code" desc="代码"/>
            <item name="cname" desc="名称"/>
            <item name="sname" desc="简称"/>
            <item name="pathIds" desc="路径" notes="ROOT_ID-10001-10002…"/>
            <item name="orderNo" desc="顺序号" type="Integer"/>
            <item name="parentId" desc="上级部门" type="Integer"/>
            <item name="parentValue" desc="上级部门名称" mapper="ORG_HASH" target="parentId"/>
        </item-tree>
    </rcv>
</trans>
